rsid	chrom	pos	ref	alt	gene	trait_category	trait	effect_allele	effect_description	evidence_level	pmid
rs9939609	chr16	53786615	T	A	FTO	nutrigenomics	Obesity susceptibility	A	Each A allele increases BMI by ~0.35 kg/m2 and obesity risk by ~1.2x	strong	17434869
rs4988235	chr2	135851076	G	A	MCM6	nutrigenomics	Lactose tolerance	A	A allele (T on coding strand) confers lactase persistence in Europeans	strong	11788828
rs174547	chr11	61797212	T	C	FADS1	nutrigenomics	Omega-3/6 metabolism	C	C allele associated with lower desaturase activity and altered fatty acid levels	strong	21829377
rs1801133	chr1	11796321	G	A	MTHFR	nutrigenomics	Folate metabolism (C677T)	A	A allele (677T) reduces enzyme activity ~35% per allele; homozygous ~70% reduction	strong	8630491
rs1801131	chr1	11794419	T	G	MTHFR	nutrigenomics	Folate metabolism (A1298C)	G	G allele (1298C) mildly reduces MTHFR activity; compound heterozygosity with C677T increases risk	moderate	10444342
rs5082	chr1	161222292	G	A	APOA2	nutrigenomics	Saturated fat sensitivity	A	AA homozygotes have higher BMI on high saturated fat diets	moderate	19131637
rs713598	chr7	141972804	G	C	TAS2R38	nutrigenomics	Bitter taste perception	C	Part of PAV haplotype conferring strong bitter taste sensitivity	strong	12595690
rs1815739	chr11	66560624	C	T	ACTN3	exercise	Sprint/power muscle fiber	T	T allele (577X) causes alpha-actinin-3 deficiency; CC genotype favors sprint/power	strong	12879365
rs1800012	chr17	50200388	G	T	COL1A1	exercise	Tendon/ligament injury risk	T	T allele associated with reduced risk of cruciate ligament rupture	moderate	18191882
rs12722	chr9	134840750	T	C	COL5A1	exercise	Ligament flexibility	C	C allele associated with increased ligament and tendon injury risk	moderate	19584899
rs8192678	chr4	23814039	G	A	PPARGC1A	exercise	Endurance capacity	A	A allele (Gly482Ser) associated with reduced aerobic capacity	moderate	14613869
rs1800795	chr7	22726627	G	C	IL6	exercise	Exercise recovery/inflammation	C	C allele associated with higher IL-6 levels and increased inflammation response	moderate	9831340
rs1800629	chr6	31575254	G	A	TNF	exercise	Inflammation response	A	A allele associated with higher TNF-alpha production and inflammation	moderate	8833553
rs762551	chr15	74749576	A	C	CYP1A2	metabolism	Caffeine metabolism	C	C allele = slow caffeine metabolizer; AC/CC genotypes at higher cardiovascular risk with high coffee intake	strong	16522833
rs1229984	chr4	99318162	T	C	ADH1B	metabolism	Alcohol metabolism	C	C allele (His48Arg) causes rapid alcohol to acetaldehyde conversion; protective against alcoholism	strong	19584899
rs671	chr12	111803962	G	A	ALDH2	metabolism	Alcohol flush reaction	A	A allele causes alcohol flush reaction and acetaldehyde accumulation; very common in East Asians	strong	20855893
rs6025	chr1	169549811	C	T	F5	cardiovascular	Factor V Leiden thrombophilia	T	T allele (Arg506Gln) causes activated protein C resistance; 3-8x increased VTE risk heterozygous	strong	7989264
rs1799963	chr11	46739505	G	A	F2	cardiovascular	Prothrombin thrombophilia	A	A allele (20210G>A) increases prothrombin levels; 2-3x increased VTE risk	strong	8679209
rs429358	chr19	44908684	T	C	APOE	cardiovascular	APOE e4 allele (part 1)	C	Part of APOE e4 haplotype. e4 carriers have increased LDL and Alzheimer risk	strong	8346443
rs7412	chr19	44908822	C	T	APOE	cardiovascular	APOE e2 allele (part 2)	T	Part of APOE e2 haplotype. e2/e2 associated with type III hyperlipoproteinemia	strong	8346443
rs1800562	chr6	26091179	G	A	HFE	other	Hereditary hemochromatosis (C282Y)	A	A allele (C282Y) most common HFE mutation; homozygous = high iron overload risk	strong	8696333
rs1799945	chr6	26090951	C	G	HFE	other	Hereditary hemochromatosis (H63D)	G	G allele (H63D) mildly increases iron absorption; compound heterozygote C282Y/H63D increases risk	strong	8696333
rs8175347	chr2	233759924	TA	TAn	UGT1A1	other	Gilbert syndrome	TAn	(TA)7 repeat (*28) reduces UGT1A1 expression; causes benign unconjugated hyperbilirubinemia	strong	7481376
